{
  "sep_version": "2026-04-21-r41",
  "aud_hash_hex": "e4b259de5352880ebf7d058d3ce2787a7d7b68ec9fc71e94d8b2f8ae98298e3a",
  "K_tok_enc_hex": "d3d0531ba8997440036ee7912ffa7b663548b72bbe722f41c51b5f41c802eb4c",
  "tqs_sk_hex": "03dfc14b6fa00330ef620b0d26655611481dfdb7dcc1b9e9b93d547d8c340093",
  "TQS_PK_hex": "a242796a36f13abfd92958a8b040f9211c1311f54d02a9fe043c8447e69da177",
  "K_priv_hex": "2a5301cbb03d8832957e1360f16cc1cf7f3be43df5d14029caa083efe35aafb7",
  "priv_sig_hex": "f6866f190fac124b0b5633b623ff571804c13d86e566a264baad404cc39ca39d",
  "K_req_hex": "2fbfb4f3aa2fe4a615b39e3b495135e16e4e5b814e3b022d3e5cc1f2500d476e",
  "K_resp_hex": "05390eccb0d0dfe3d75cd30fd902d1b1322065efef63d307e45384d5d932a4af",
  "IV_resp_hex": "593409a73161ec120525a9b9",
  "scope_tlv_hex": "0112706f6c6963792d656e67696e652d74657374021a494b3a746573742d636c69656e742d66696e6765727072696e74030a746573742d6167656e74040e71756572795f6461746162617365050472656164061c62696c6c696e672d6170692f696e766f696365732f323032352d5133072101080000000000000064020800000000000000010308000000000000001e040101080800000000000000000a01000b1a68747470733a2f2f72732e6578616d706c652e636f6d2f6d63700c0a6f72672d612d70726f640d0800000000000000020e080000000000000000",
  "token_hex": "0301030000000000deadbeef0102030400000000000000010000000067ca37000000000067ca373c0000000000000001e4b259de5352880ebf7d058d3ce2787a7d7b68ec9fc71e94d8b2f8ae98298e3a41414543417751464267634943516f4c4441304f44770000b012121712202878588dee169ea6bf4c5ebda7a7442e1b625e70eee8849aef7a5d8ca9cc81b1ded920dd1212c7ed62d6717db348f35af7ec2496420c9625694f7c9523969f144aa1f16388e8bb0c320c1c84db19a3ff321df86db3fe2a4510f89293d6ae675f6eb5956325ce3fae72ef6f507796fadde5c38dc34c1bf7b8857f8aa1a5c0a4df6dfdd39f670089b344f73b398a7c72eb7ebeed5459c2a446f75e7ec0784c45430df9786b29dce3ad745a9fe34ce6a677abb757741fbe618f445651e758d1f707ea2c68a5ab6a4353e5fb891b1bef3fef5839492ffcefd1d4dd504dd523fe96db29aff4fc2de98a321321ac373f7a52e127c274feff92ae2627e96d6b74c904a788098121e80aab114609027d4da2a0e50cfbcfdb8ae952983cc7eba287ecdd2002f3423fb1b00f9ab57b34c42195edf422af0361ac356a447bf072242828dca1e0c07ce812456952f6444d0a0b7dfd83ea3b38fed8b4b42f5726bd6aefbe0e65f74880fe400168c9dfc1e46766bf63658082527d66e37ce0982f2c90fa7b94839075b07bdde208f252764c39fc020ff9b0fc66dedaaa11a62f79bc5e8e82b5c7a2112875d64a1f00625aa37872d810d729"
}
